{
  "schema_version": "1.0.0",
  "database_name": "skyodor_content",
  "database_purpose": "Canonical structured content source for the new website. This file separates verified source data from unresolved fields and preserves provenance for every record.",
  "locale": "zh-Hant-TW",
  "currency": "TWD",
  "source": {
    "domain": "www.skyodor.com",
    "baseline_path": "site/v0.1",
    "branch": "new-site-v1",
    "extraction_status": "cataloged_with_unresolved_fields",
    "rules": [
      "Never invent missing source content.",
      "Preserve original Traditional Chinese wording when verified.",
      "Use null for unknown values; do not use fabricated placeholders.",
      "Every publishable record must have a source reference and verification status.",
      "Legacy source files are read-only reference data and must not be deleted."
    ]
  },
  "data_contract": {
    "required_entity_fields": ["id", "entity_type", "status", "source_refs", "updated_at"],
    "verification_statuses": ["verified", "partially_verified", "unverified", "not_found", "needs_review"],
    "publication_statuses": ["draft", "review", "approved", "published", "archived"],
    "null_policy": "Unknown or unextracted values are null. Empty strings are reserved for confirmed source-empty values.",
    "id_policy": "IDs are stable, lowercase, ASCII identifiers and must not be reused for a different entity."
  },
  "entities": {
    "site": {
      "id": "site-skyodor",
      "entity_type": "site",
      "brand_name": "蝶漾香韻",
      "brand_name_latin": "ODOR",
      "domain": "www.skyodor.com",
      "locale": "zh-Hant-TW",
      "currency": "TWD",
      "status": "partially_verified",
      "publication_status": "draft",
      "source_refs": ["site/v0.1/index.html"],
      "updated_at": "2026-09-20",
      "notes": ["Brand and domain are source-derived.", "Business contact and legal information require direct source verification."]
    },
    "pages": [
      {
        "id": "page-home",
        "entity_type": "page",
        "slug": "/",
        "source_path": "index.html",
        "page_type": "home",
        "title": "蝶漾香韻",
        "verification_status": "partially_verified",
        "publication_status": "draft",
        "source_refs": ["site/v0.1/index.html"],
        "updated_at": "2026-09-20"
      },
      {
        "id": "page-category",
        "entity_type": "page",
        "slug": "/category.html",
        "source_path": "category.html",
        "page_type": "category",
        "title": "蝶漾香韻大香",
        "verification_status": "partially_verified",
        "publication_status": "draft",
        "source_refs": ["site/v0.1/category.html"],
        "updated_at": "2026-09-20"
      },
      {
        "id": "page-product-30ml",
        "entity_type": "page",
        "slug": "/products/30ml",
        "source_path": "27785393213193427833393212770030ml.html",
        "page_type": "product_catalog",
        "title": "沉香精油香水30ml",
        "verification_status": "partially_verified",
        "publication_status": "draft",
        "source_refs": ["site/v0.1/27785393213193427833393212770030ml.html"],
        "updated_at": "2026-09-20"
      },
      {
        "id": "page-product-guandi",
        "entity_type": "page",
        "slug": "/products/guandi-50ml",
        "source_path": "27785393213193427833393212770050ml.html",
        "page_type": "product",
        "title": "關聖帝君沉香50ml",
        "verification_status": "partially_verified",
        "publication_status": "draft",
        "source_refs": ["site/v0.1/27785393213193427833393212770050ml.html"],
        "updated_at": "2026-09-20"
      },
      {
        "id": "page-product-50mlx",
        "entity_type": "page",
        "slug": "/products/50mlx",
        "source_path": "27785393213193427833393212770050mlx.html",
        "page_type": "product",
        "title": "沉香精油香水50mlx",
        "verification_status": "partially_verified",
        "publication_status": "draft",
        "source_refs": ["site/v0.1/27785393213193427833393212770050mlx.html"],
        "updated_at": "2026-09-20"
      },
      {
        "id": "page-incense-life",
        "entity_type": "page",
        "slug": "/incense-life",
        "source_path": "21697393212998327963.html",
        "page_type": "content",
        "title": "品香生活",
        "verification_status": "partially_verified",
        "publication_status": "draft",
        "source_refs": ["site/v0.1/21697393212998327963.html"],
        "updated_at": "2026-09-20"
      },
      {
        "id": "page-diffuser-wood",
        "entity_type": "page",
        "slug": "/diffuser-wood",
        "source_path": "258443932122294394722640829255.html",
        "page_type": "content",
        "title": "擴香圖騰木片",
        "verification_status": "partially_verified",
        "publication_status": "draft",
        "source_refs": ["site/v0.1/258443932122294394722640829255.html"],
        "updated_at": "2026-09-20"
      },
      {
        "id": "page-order-process",
        "entity_type": "page",
        "slug": "/purchase-process",
        "source_path": "36092360232796931243.html",
        "page_type": "content",
        "title": "購買流程",
        "verification_status": "needs_review",
        "publication_status": "draft",
        "source_refs": ["site/v0.1/36092360232796931243.html"],
        "updated_at": "2026-09-20"
      }
    ],
    "products": [
      {"id":"product-c1","entity_type":"product","code":"NO.C1","name":"皇室派對","size":"30ml","price_twd":2450,"description":"香水 傳遞的不是故事 不是香味替代言語 是一個人給我的溫度 是我所認識的那個人 內在傳遞的訊息 單純是一個人的個性","verification_status":"verified","publication_status":"draft","source_refs":["site/v0.1/27785393213193427833393212770030ml.html"],"updated_at":"2026-09-20"},
      {"id":"product-c2","entity_type":"product","code":"NO.C2","name":"紐約那天","size":"30ml","price_twd":2450,"description":"人生無常 記得親一下 抱一下穿暖一些在出門 旅途平安 紐約","verification_status":"partially_verified","publication_status":"draft","source_refs":["site/v0.1/27785393213193427833393212770030ml.html"],"updated_at":"2026-09-20"},
      {"id":"product-c3","entity_type":"product","code":"NO.C3","name":"偷心戀人","size":"30ml","price_twd":2450,"description":null,"verification_status":"partially_verified","publication_status":"draft","source_refs":["site/v0.1/27785393213193427833393212770030ml.html"],"updated_at":"2026-09-20"},
      {"id":"product-p9","entity_type":"product","code":"NO.P9","name":"絕妙玫瑰","size":"30ml","price_twd":2450,"description":null,"verification_status":"partially_verified","publication_status":"draft","source_refs":["site/v0.1/27785393213193427833393212770030ml.html"],"updated_at":"2026-09-20"},
      {"id":"product-p10","entity_type":"product","code":"NO.P10","name":"韶光","size":"30ml","price_twd":2450,"description":null,"verification_status":"partially_verified","publication_status":"draft","source_refs":["site/v0.1/27785393213193427833393212770030ml.html"],"updated_at":"2026-09-20"},
      {"id":"product-p11","entity_type":"product","code":"NO.P11","name":"戀玫瑰","size":"30ml","price_twd":3200,"description":null,"verification_status":"partially_verified","publication_status":"draft","source_refs":["site/v0.1/category.html"],"updated_at":"2026-09-20"},
      {"id":"product-p12","entity_type":"product","code":"NO.P12","name":"關聖帝君沉香香水","size":"30ml","price_twd":3000,"description":"安定靈魂 養護元神 護身避煞 常保平安 淨身淨地 穩定磁場 加強除穢 靈體防護","verification_status":"verified","publication_status":"draft","source_refs":["site/v0.1/27785393213193427833393212770050ml.html"],"updated_at":"2026-09-20"},
      {"id":"product-p13","entity_type":"product","code":"NO.P13","name":"王母娘娘聖露水","size":"50ml","price_twd":3900,"description":null,"verification_status":"partially_verified","publication_status":"draft","source_refs":["site/v0.1/27785393213193427833393212770050mlx.html"],"updated_at":"2026-09-20"}
    ],
    "offerings": [
      {"id":"offering-agarwood-incense","entity_type":"offering","name":"逸品 立臥沉香","price_twd":3600,"source_page":"21697393212998327963.html","verification_status":"partially_verified","publication_status":"draft","source_refs":["site/v0.1/21697393212998327963.html"],"updated_at":"2026-09-20"},
      {"id":"offering-agarwood-gift-box","entity_type":"offering","name":"韻品 沉香禮盒","price_twd":2880,"source_page":"21697393212998327963.html","verification_status":"partially_verified","publication_status":"draft","source_refs":["site/v0.1/21697393212998327963.html"],"updated_at":"2026-09-20"},
      {"id":"offering-agarwood-oil","entity_type":"offering","name":"寰宇凝萃 天然沉香純單方精油","price_options":[{"size":"1ml","price_twd":3900},{"size":"3ml","price_twd":10900}],"source_page":"21697393212998327963.html","verification_status":"partially_verified","publication_status":"draft","source_refs":["site/v0.1/21697393212998327963.html"],"updated_at":"2026-09-20"},
      {"id":"offering-totem-diffuser","entity_type":"offering","name":"圖騰擴香木片組","price_twd":1480,"refill_note":"香精油加購優惠$850","source_page":"258443932122294394722640829255.html","verification_status":"partially_verified","publication_status":"draft","source_refs":["site/v0.1/258443932122294394722640829255.html"],"updated_at":"2026-09-20"}
    ],
    "brand_content": [
      {"id":"brand-hero","entity_type":"brand_content","key":"hero_title","value":"剎那與永恆","verification_status":"verified","source_refs":["site/v0.1/index.html"],"updated_at":"2026-09-20"},
      {"id":"brand-keynote","entity_type":"brand_content","key":"keynote","value":"沉香","verification_status":"verified","source_refs":["site/v0.1/index.html"],"updated_at":"2026-09-20"},
      {"id":"brand-core-value","entity_type":"brand_content","key":"core_value","value":"合香與調香","verification_status":"verified","source_refs":["site/v0.1/index.html"],"updated_at":"2026-09-20"},
      {"id":"brand-opening","entity_type":"brand_content","key":"opening_instruction","value":"三角形LOGO鈕扣右推打開，左推闔上。","verification_status":"verified","source_refs":["site/v0.1/index.html"],"updated_at":"2026-09-20"}
    ],
    "assets": {